section,element_type,text
MANAGEMENT_DISCUSSION,NarrativeText,"""Abbott has readily available financial resources, including unused lines of credit that support commercial paper borrowing arrangements and provide Abbott with the ability to borrow up to $5 billion on an unsecured basis. On January 29, 2024, Abbott terminated its 2020 Five Year Credit Agreement (2020 Agreement) and entered into a new Five Year Credit Agreement (Revolving Credit Agreement). There were no outstanding borrowings under the 2020 Agreement at the time of its termination. Any borrowings under the Revolving Credit Agreement will mature and be payable on January 29, 2029 and will bear interest, at Abbott’s option, based on either a base rate or Secured Overnight Financing Rate (SOFR), plus an applicable margin based on Abbott’s credit ratings."""
MANAGEMENT_DISCUSSION,NarrativeText,"""As of December 31, 2024, Abbott's total debt outstanding was $14.1 billion, of which approximately $1.5 billion will mature in 2025. On June 26, 2024, Abbott modified its existing, yen-denominated 5-year term loan scheduled to mature in November 2024. The amended terms include a net increase in principal debt from ¥59.8 billion to ¥92.0 billion, with a new maturity date in June 2029. The modified, 5-year term loan bears interest at the Tokyo Interbank Offered Rate (TIBOR) plus a fixed spread, and the interest rate is reset quarterly. The net proceeds equated to approximately $201 million. The ¥92.0 billion loan is designated as a hedge of Abbott’s net investment in certain foreign subsidiaries."""
MANAGEMENT_DISCUSSION,NarrativeText,"""On November 19, 2024, Abbott repaid the €590 million outstanding principal amount of its 0.10% Notes upon maturity. The repayment equated to approximately $640 million. On November 30, 2023, Abbott repaid the $1.05 billion outstanding principal amount of its 3.40% Notes upon maturity. On September 27, 2023, Abbott repaid the €1.14 billion outstanding principal amount of its 0.875% Notes upon maturity. The repayment equated to approximately $1.2 billion. In September 2023, Abbott repaid approximately $197 million of debt assumed as part of a recent business acquisition."""
MANAGEMENT_DISCUSSION,NarrativeText,"""On October 11, 2024, the board of directors authorized the repurchase of up to $7 billion of Abbott common shares, from time to time (the """"2024 repurchase program""""). The 2024 repurchase program is in addition to the unused portion of the 2021 repurchase program, which the board of directors approved in December 2021 and authorized the repurchase of up to $5 billion of Abbott’s common shares from time to time. As of December 31, 2024, $293 million remains available for repurchase under the 2021 repurchase program. In 2024 and 2023, Abbott repurchased approximately 10.2 million and 9.8 million, respectively, of its common shares for $1.1 billion and $1.0 billion, respectively, under the 2021 repurchase program. In 2022, Abbott repurchased 32.3 million of its common shares for $3.7 billion which fully utilized the authorization remaining under the October 2019 share repurchase program, and a portion of the 2021 repurchase program."""
MANAGEMENT_DISCUSSION,NarrativeText,"""Abbott declared dividends of $2.24 per share in 2024 compared to $2.08 per share in 2023, an increase of 7.7 percent. Dividends paid were $3.8 billion in 2024 compared to $3.6 billion in 2023. The year-over-year change in dividends paid reflects the impact of the increase in the dividend rate."""
MANAGEMENT_DISCUSSION,NarrativeText,"""Working capital was $9.5 billion at December 31, 2024 and $8.8 billion at December 31, 2023. The increase in working capital in 2024 primarily reflects an increase in cash and cash equivalents and accounts receivable, partially offset by an increase in the current portion of long-term debt. The increase in cash and cash equivalents from $6.9 billion at December 31, 2023 to $7.6 billion at December 31, 2024 primarily reflects the cash generated from operations and an increase in Abbott's yen-denominated loan, partially offset by the payment of dividends and capital expenditures."""
MANAGEMENT_DISCUSSION,NarrativeText,"""Abbott monitors the credit worthiness of customers and establishes an allowance that reflects the current estimate of credit losses expected to be incurred over the life of the financial asset. Abbott considers various factors in establishing, monitoring, and adjusting its allowance for doubtful accounts, including the aging of the accounts and aging trends, the historical level of charge-offs, and specific exposures related to particular customers. Abbott also monitors other risk factors and forward-looking information, such as country risk, when determining credit limits for customers and establishing adequate allowances."""
MANAGEMENT_DISCUSSION,NarrativeText,"""Capital expenditures of $2.2 billion in 2024 and 2023, and $1.8 billion in 2022 were principally for upgrading and expanding manufacturing and research and development facilities and equipment in various segments, investments in information technology, and laboratory instruments placed with customers."""
MANAGEMENT_DISCUSSION,NarrativeText,Abbott believes that its available cash and cash equivalents along with its ability to generate operating cash flow and continued access to debt markets are sufficient to fund existing and planned cash requirements. Abbott's material cash requirements include the following contractual obligations:
MANAGEMENT_DISCUSSION,NarrativeText,"""— Principal payments required on long-term debt outstanding at December 31, 2024 are $1.5 billion in 2025, $2.9 billion in 2026, $617 million in 2027, $650 million in 2028, $583 million in 2029 and $8.0 billion in 2030 and thereafter. Interest payments required on long-term debt outstanding at December 31, 2024 are projected to be $512 million in 2025, $478 million in 2026, $396 million in 2027, $390 million in 2028, $384 million in 2029 and $4.7 billion in 2030 and thereafter."""
MANAGEMENT_DISCUSSION,NarrativeText,"""— As of December 31, 2024, estimated contractual obligations for operating lease payments were $1.3 billion, with $290 million due within 12 months."""
MANAGEMENT_DISCUSSION,NarrativeText,"""In addition, Abbott enters into purchase commitments in the normal course of business to meet operational and capital expenditure requirements. The majority of outstanding purchase commitments generally do not extend past one year."""
MANAGEMENT_DISCUSSION,NarrativeText,Abbott periodically acquires a business or product rights in which Abbott agrees to pay contingent consideration based on attaining certain thresholds or based on the occurrence of certain events.
MANAGEMENT_DISCUSSION,NarrativeText,"""On September 22, 2023, Abbott completed the acquisition of Bigfoot, which furthers Abbott's efforts to develop connected solutions for making diabetes management more personal and precise. The purchase price, the final allocation of acquired assets and liabilities, and the revenue and net income contributed by Bigfoot since the date of acquisition are not material to Abbott's consolidated financial statements."""
MANAGEMENT_DISCUSSION,NarrativeText,"""On April 27, 2023, Abbott completed the acquisition of CSI for $20 per common share, which equated to a purchase price of"""
MANAGEMENT_DISCUSSION,NarrativeText,""". The transaction was funded with cash on hand and accounted for as a business combination. CSI's atherectomy system, which is used in treating peripheral and coronary artery disease, adds complementary technologies to Abbott's portfolio of vascular device offerings."""
MANAGEMENT_DISCUSSION,NarrativeText,"""The final allocation of the purchase price of the CSI acquisition resulted in the recording of two non-deductible developed technology intangible assets totaling $305 million; a non-deductible in-process research and development asset of $15 million, which will be accounted for as an indefinite-lived intangible asset until regulatory approval or discontinuation; non-deductible goodwill of $369 million; net deferred tax assets of $46 million and other net assets of $116 million. The goodwill is identifiable to the Medical Devices reportable segment and is attributable to expected synergies from combining operations, as well as intangible assets that do not qualify for separate recognition. Revenues and earnings of CSI included in Abbott's consolidated financial statements since the acquisition date are not material to Abbott's consolidated revenue and earnings."""
MANAGEMENT_DISCUSSION,NarrativeText,"""Abbott’s primary markets are highly competitive and subject to substantial government regulations throughout the world. Abbott expects debate to continue at all government levels worldwide over the manufacture, quality assurance requirements, marketing authorization processes, post-market surveillance requirements, availability, method of delivery, and payment for health care products and services, as well as data privacy and security. It is not possible to predict the extent to which Abbott or the health care industry in general might be adversely affected by these factors in the future. A more complete discussion of these factors is contained in Item 1, Business, and Item 1A, Risk Factors."""
MANAGEMENT_DISCUSSION,NarrativeText,"""In November 2023, the FASB issued ASU 2023-07,"""
MANAGEMENT_DISCUSSION,NarrativeText,""", which expands the breadth and frequency of required segment disclosures. The guidance is required to be applied retrospectively to all periods presented in the financial statements. Abbott adopted the standard on January 1, 2024. The new standard did not have an impact on Abbott's consolidated financial statements, but required additional disclosures as included in Note 16 — Segment and Geographic Area Information."""
MANAGEMENT_DISCUSSION,NarrativeText,"""In September 2022, the FASB issued Accounting Standards Update (ASU) 2022-04,"""
MANAGEMENT_DISCUSSION,NarrativeText,""", which requires an entity to report information about its supplier finance program. Abbott adopted the standard on January 1, 2023. The new standard did not have an impact on Abbott's consolidated financial statements."""
MANAGEMENT_DISCUSSION,NarrativeText,"""In November 2024, the FASB issued ASU 2024-03,"""
MANAGEMENT_DISCUSSION,NarrativeText,""", which requires an entity to disclose on an annual and interim basis, disaggregated information about specific income statement expense categories. The guidance should be applied prospectively with the option to apply the standard retrospectively. The standard becomes effective for Abbott for full year 2027 reporting. Abbott is currently evaluating the impact of this new standard on its consolidated financial statements."""
MANAGEMENT_DISCUSSION,NarrativeText,"""In December 2023, the FASB issued ASU 2023-09,"""
MANAGEMENT_DISCUSSION,NarrativeText,""", which requires an entity to disclose annually additional information related to the company's income tax rate reconciliation and income taxes paid during the period. The guidance should be applied prospectively with the option to apply the standard retrospectively. The standard becomes effective for Abbott for full year 2025 reporting. Abbott is currently evaluating the impact of this new standard on its consolidated financial statements."""
MANAGEMENT_DISCUSSION,NarrativeText,"""Under the safe harbor provisions of the Private Securities Litigation Reform Act of 1995, Abbott cautions investors that any forward-looking statements or projections made by Abbott, including those made in this document, are subject to risks and uncertainties that may cause actual results to differ materially from those projected. Economic, competitive, governmental, technological and other factors that may affect Abbott’s operations are discussed in Item 1A, Risk Factors."""
MARKET_RISK_DISCLOSURES,NarrativeText,"""The fair value of equity securities held by Abbott with a readily determinable fair value was approximately $10 million and $12 million as of December 31, 2024 and 2023, respectively. These equity securities are subject to potential changes in fair value. A hypothetical 20 percent decrease in the share prices of these investments would decrease their fair value at December 31, 2024 by approximately $2 million. Changes in the fair value of these securities are recorded in earnings. The fair value of investments in mutual funds that are held in a rabbi trust for the purpose of paying benefits under a deferred compensation plan was approximately $313 million and $314 million as of December 31, 2024 and 2023, respectively. Changes in the fair value of these investments, as well as an offsetting change in the benefit obligation, are recorded in earnings."""
MARKET_RISK_DISCLOSURES,NarrativeText,"""Abbott holds equity securities that are not traded on public stock exchanges. The carrying value of these investments was $91 million and $88 million as of December 31, 2024 and 2023, respectively. No individual investment is recorded at a value in excess of $20 million. Abbott measures these investments at cost minus impairment, if any, plus or minus changes resulting from observable price changes in orderly transactions for the identical or a similar investment of the same issuer."""
MARKET_RISK_DISCLOSURES,NarrativeText,"""At December 31, 2024 and 2023, Abbott had interest rate hedge contracts with notional values totaling $2.2 billion to manage its exposure to changes in the fair value of debt. The effect of these hedges is to change the fixed interest rate to a variable rate for the portion of the debt that is hedged. Abbott does not use derivative financial instruments, such as interest rate swaps, to manage its exposure to changes in interest rates for its investment securities. The fair value of long-term debt at December 31, 2024 and 2023 amounted to $13.7 billion and $14.8 billion, respectively (average interest rates of 3.8% and 3.6% as of December 31, 2024 and 2023, respectively) with maturities through 2046. At December 31, 2024 and 2023, the fair value of current and long-term investment securities amounted to approximately $1.2 billion. A hypothetical 100-basis point change in the interest rates would not have a material effect on cash flows, income or fair values."""
MARKET_RISK_DISCLOSURES,NarrativeText,"""Certain Abbott foreign subsidiaries enter into foreign currency forward exchange contracts to manage exposures to changes in foreign exchange rates for anticipated intercompany purchases by those subsidiaries whose functional currencies are not the U.S. dollar. These contracts are designated as cash flow hedges of the variability of the cash flows due to changes in foreign currency exchange rates and are marked-to-market with the resulting gains or losses reflected in Accumulated other comprehensive income (loss). Gains or losses will be included in Cost of products sold at the time the products are sold, generally within the next twelve to eighteen months. At December 31, 2024 and 2023, Abbott held $7.0 billion and $7.3 billion of notional values, respectively, of such contracts. Contracts held at December 31, 2024 will mature in 2025 or 2026 depending on the contract. Contracts held at December 31, 2023 matured in 2024 or will mature in 2025 depending upon the contract."""
MARKET_RISK_DISCLOSURES,NarrativeText,"""Abbott enters into foreign currency forward exchange contracts to manage its exposure to foreign currency denominated intercompany loans and trade payables and third-party trade payables and receivables. The contracts are marked-to-market, and resulting gains or losses are reflected in income and are generally offset by losses or gains on the foreign currency exposure being managed. At December 31, 2024 and 2023, Abbott held $16.2 billion and $13.8 billion of notional values, respectively, of such contracts, which mature within 13 months."""
MARKET_RISK_DISCLOSURES,NarrativeText,"""Abbott has designated a yen-denominated, 5-year term loan of approximately $583 million and $419 million as of December 31, 2024 and December 31, 2023, respectively, as a hedge of the net investment in certain foreign subsidiaries. The change in the value of the debt"""
MARKET_RISK_DISCLOSURES,NarrativeText,is due to
MARKET_RISK_DISCLOSURES,NarrativeText,"""net incremental borrowing of $201 million, discussed in Note 10 — Debt and Lines of Credit, as well as changes in foreign exchange rates, recorded in Accumulated other comprehensive income (loss), net of tax."""
MARKET_RISK_DISCLOSURES,NarrativeText,"""The following table reflects the total foreign currency forward exchange contracts outstanding at December 31, 2024 and 2023:"""
MARKET_RISK_DISCLOSURES,NarrativeText,Fair andCarrying ValueReceivable/(Payable)
MARKET_RISK_DISCLOSURES,NarrativeText,Fair andCarrying ValueReceivable/(Payable)
MARKET_RISK_DISCLOSURES,NarrativeText,Primarily U.S. dollars to be exchanged for the following currencies:
CONTROLS_AND_PROCEDURES,NarrativeText,"""The Chief Executive Officer, Robert B. Ford, and the Chief Financial Officer, Philip P. Boudreau, evaluated the effectiveness of Abbott Laboratories’ disclosure controls and procedures as of the end of the period covered by this report, and concluded that Abbott Laboratories’ disclosure controls and procedures were effective to ensure that information Abbott is required to disclose in the reports that it files or submits with the Commission under the Securities Exchange Act of 1934 (the Exchange Act) is recorded, processed, summarized and reported, within the time periods specified in the Commission’s rules and forms, and to ensure that information required to be disclosed by Abbott in the reports that it files or submits under the Exchange Act is accumulated and communicated to Abbott’s management, including its principal executive officer and principal financial officer, as appropriate to allow timely decisions regarding required disclosure."""
CONTROLS_AND_PROCEDURES,NarrativeText,Management’s annual report on internal control over financial reporting.
CONTROLS_AND_PROCEDURES,NarrativeText,Management’s report on Abbott’s internal control over financial reporting is included on page 76 hereof. The report of Abbott’s independent registered public accounting firm related to their assessment of the effectiveness of internal control over financial reporting is included on page 79 hereof.
CONTROLS_AND_PROCEDURES,NarrativeText,"""During the quarter ended December 31, 2024, there were no changes in Abbott’s internal control over financial reporting (as defined in Rule 13a-15(f) under the Exchange Act) that have materially affected, or are reasonably likely to materially affect, Abbott’s internal control over financial reporting."""
MANAGEMENT,NarrativeText,"""Abbott’s revenues are derived primarily from the sale of a broad line of health care products, which include medical devices, diagnostic testing products, nutritional products and branded generic pharmaceuticals. These products are sold under short-term receivable arrangements. Patent protection and licenses, technological and performance features, and inclusion of Abbott’s products under a contract most impact which products are sold; price controls, competition and rebates most impact the net selling prices of products; and the measurement of net sales and costs is impacted by foreign currency translation. Sales in international markets comprise 61 percent of consolidated net sales."""
MANAGEMENT,NarrativeText,"""Abbott’s sales growth in 2024 was primarily driven by the Medical Devices, Established Pharmaceutical and Nutritional businesses. The growth is the result of a productive research and development (R&D) pipeline and a combination of the introduction of new products and indication expansions across various businesses. Sales growth was negatively impacted by continued year-over-year decline in COVID-19 testing-related sales, as the COVID-19 pandemic shifted to an endemic state. In 2024, 2023 and 2022, Abbott’s COVID-19 testing related sales total $747 million, $1.6 billion and $8.4 billion, respectively. Sales in emerging markets, which represent approximately 37 percent of total company sales, increased 8.2 percent in 2024 and 5.4 percent in 2023, excluding the impact of foreign exchange. (Emerging markets include all countries, except the United States, Japan, Canada, Australia, New Zealand, the United Kingdom and Western European countries.)"""
MANAGEMENT,NarrativeText,"""Abbott’s operating margin profile increased in 2024 to 16.3 percent from 16.2 percent in 2023. The increase in 2024 reflects the favorable impact of margin improvement initiatives, partially offset by foreign exchange and inflation. In 2022, operating margin as a percentage of sales was 19.2 percent. The decrease in 2023 from 2022 reflects the unfavorable effects of lower COVID-19 testing-related sales, foreign exchange, and higher costs for various manufacturing inputs. In 2023, these unfavorable effects were partially offset by the favorable impact of margin improvement initiatives."""
MANAGEMENT,NarrativeText,"""With respect to the performance of each reportable segment over the last three years, sales in the Medical Devices segment, excluding the impact of foreign exchange, increased 13.7 percent in 2024 and 15.1 percent in 2023. In Medical Devices, sales in 2024 and 2023 increased across all businesses, with double-digit growth in Diabetes Care, Structural Heart, Electrophysiology, and Heart Failure. In 2023, Neuromodulation sales also increased double digits. Growth was led by Diabetes Care where sales of Abbott's continuous glucose monitoring (CGM) systems continued to increase and totaled $6.4 billion in 2024 and $5.3 billion in 2023."""
MANAGEMENT,NarrativeText,"""In 2024, key product approvals in the Medical Devices segment included:"""
MANAGEMENT,NarrativeText,"""and Libre Rio™, which are based on Abbott's FreeStyle Libre"""
MANAGEMENT,ListItem,"""FDA approval of the Esprit™ below-the-knee (BTK) system, which is designed to keep arteries open in people living with peripheral artery disease and deliver a drug to support vessel healing prior to completely dissolving,"""
MANAGEMENT,ListItem,"""FDA approval of TriClip®, which provides a minimally invasive treatment option for patients with tricuspid regurgitation, or a leaky tricuspid heart valve,"""
MANAGEMENT,ListItem,"""CE Mark for the Aveir® dual chamber (DR) leadless pacemaker system, which is the world's first dual chamber leadless pacemaker system that treats people with abnormal or slow heart rhythms, and"""
MANAGEMENT,ListItem,"""FDA clearance for Advisor® HD Grid X Mapping Catheter, Sensor Enabled™, which will further support mapping of both pulsed field ablation (PFA) and radiofrequency (RF) ablation cases."""
MANAGEMENT,NarrativeText,Operating earnings for the Medical Devices segment increased 16.0 percent in 2024 and 19.6 percent in 2023. The operating margin profile for the Medical Devices segment increased from 30.0 percent in 2022 to 31.4 percent in 2023 and then increased to 32.4 percent in 2024. The increase in 2024 from 2022 reflects the impact of higher sales volumes across the Medical Devices businesses.
MANAGEMENT,NarrativeText,"""In Abbott’s Diagnostics segment, sales decreased 3.9 percent in 2024 and 38.2 percent in 2023, excluding the impact of foreign exchange. The 2024 and 2023 sales decreases were driven by continued lower demand for the company's portfolio of COVID-19 tests, partially offset by higher volume of routine diagnostic tests in the Rapid Diagnostics and Core Laboratory businesses and the continued deployment of Abbott's Alinity"""
MANAGEMENT,NarrativeText,"""testing platform. Abbott continues to build out its test menu for the Alinity testing platform. In the first quarter of 2024, Abbott received FDA clearance of its i-STAT™ traumatic brain injury (TBI) cartridge for use with the i-STAT Alinity instrument, a whole blood point-of-care test to help assess mild TBI. In the fourth quarter of 2023, Abbott received FDA approval of its new laboratory automation system, GLP systems Track™, to help laboratories optimize lab performance by consolidating multiple analytical instruments into a unified workflow."""
MANAGEMENT,NarrativeText,"""In 2024, operating earnings for the Diagnostics segment decreased 14.8 percent. The operating margin profile decreased from 40.3 percent in 2022 to 22.2 percent in 2024 primarily due to lower demand for Abbott's COVID-19 tests."""
MANAGEMENT,NarrativeText,"""In Abbott’s Nutritional Products segment, total pediatric nutrition sales, excluding the impact of foreign exchange, increased 3.7 percent in 2024 and 14.8 percent in 2023, which includes market share recovery in the U.S. infant formula business following the voluntary recall of certain products in 2022, as discussed below, and the continued favorable impact of price increase initiatives. Excluding the impact of foreign exchange, total adult nutrition sales increased 8.0 percent in 2024 and 8.8 percent in 2023, led by the continued growth of Abbott's Ensure"""
MANAGEMENT,NarrativeText,products. U.S. Adult Nutritionals sales were partially offset by the discontinuation of the ZonePerfect
