section,element_type,text
MANAGEMENT,NarrativeText,"""Abbott’s operations in Russia and Ukraine represent approximately 2 percent of Abbott’s total revenues and net assets, and to date the financial impact of Russia’s invasion of Ukraine has not been material to Abbott’s operations or financial condition. Future implications are difficult to predict, but at present Abbott does not anticipate that the Russia-Ukraine conflict will have a material impact on its operations or financial condition. A more detailed discussion of the risks associated with the Russia-Ukraine conflict is contained in Item 1A. Risk Factors."""
MANAGEMENT,NarrativeText,The expiration of licenses and patent protection can affect the future revenues and operating income of Abbott. There are no significant patent or license expirations in the next three years that are expected to materially affect Abbott.
MANAGEMENT,NarrativeText,Gross profit margins were
MANAGEMENT,NarrativeText,"""of net sales in 2022. The increase in 2024 reflects the favorable impacts of margin improvement initiatives, partially offset by the unfavorable effect of foreign exchange. The decrease in 2023 reflects the unfavorable effects of lower sales of COVID-19 tests, foreign exchange, and higher costs for various manufacturing inputs, partially offset by the nonrecurrence of the negative impact in 2022 of the voluntary product recall in the nutritional business and the impact in 2023 of margin improvement initiatives."""
MANAGEMENT,NarrativeText,"""Research and development (R&D) expenses were $2.8 billion in 2024, $2.7 billion in 2023, and $2.9 billion in 2022. The increase in R&D expense in 2024 was primarily driven by higher spending on various projects, partially offset by lower 2024 charges for the impairment of in-process R&D (IPR&D) assets acquired in previous business combinations. In 2023, the decrease in R&D expense was primarily driven by lower restructuring charges, lower impairment charges related to IPR&D acquired in previous business combinations, and other cost reductions."""
MANAGEMENT,NarrativeText,"""Selling, general and administrative (SG&A) expenses were $11.7 billion in"""
MANAGEMENT,NarrativeText,""". In 2024, higher selling and marketing spending to drive growth across various businesses was partially offset by the favorable impact of foreign exchange."""
MANAGEMENT,NarrativeText,"""The 2023 decrease in SG&A expenses reflects the favorable impact of foreign exchange and lower restructuring charges in 2023, as well as the non-recurrence of 2022 expenses related to the voluntary product recall in the Nutritional Products segment."""
MANAGEMENT,NarrativeText,"""In 2024, Abbott management approved plans to streamline certain operations in order to reduce costs and improve efficiencies in its Diagnostic, Medical Devices, Established Pharmaceutical and Nutritional businesses, including the discontinuation of its ZonePerfect"""
MANAGEMENT,NarrativeText,product line. Abbott recorded employee related severance and other charges of
MANAGEMENT,NarrativeText,"""was recorded in Cost of products sold,"""
MANAGEMENT,NarrativeText,"""was recorded in Research and development, and"""
MANAGEMENT,NarrativeText,"""was recorded in Selling, general and administrative expenses. Payments related to these actions totaled $"""
MANAGEMENT,NarrativeText,2024 and the remaining liability totaled $
MANAGEMENT,NarrativeText,"""at December 31, 2024. In addition, Abbott recognized inventory related charges of"""
MANAGEMENT,NarrativeText,and fixed asset impairment charges of
MANAGEMENT,NarrativeText,related to these restructuring plans.
MANAGEMENT,NarrativeText,"""In 2023, Abbott management approved plans to restructure various operations in order to reduce costs in its Medical Devices, Diagnostic, and Established Pharmaceutical businesses. Abbott recorded employee related severance and other charges of $144 million of which approximately $56 million was recorded in Cost of products sold, $22 million was recorded in Research and development and $66 million was recorded in Selling, general and administrative expenses. In addition, Abbott recognized fixed asset impairment and inventory related charges of $31 million related to these restructuring plans."""
MANAGEMENT,NarrativeText,"""In 2022, Abbott management approved plans to streamline operations in order to reduce costs and improve efficiencies in its Medical Devices, Nutritional, Diagnostic, and Established Pharmaceutical businesses. Abbott recorded employee related severance and other charges of $234 million of which $59 million was recorded in Cost of products sold, $36 million was recorded in Research and development and $139 million was recorded in Selling, general and administrative expenses. In addition, Abbott recognized inventory related charges of $23 million and fixed asset impairment charges of $4 million related to these restructuring plans."""
MANAGEMENT,NarrativeText,"""Interest expense, net decreased from $252 million in 2023 to $215 million in"""
MANAGEMENT,NarrativeText,"""Interest expense decreased in 2024 due to the repayment of approximately $2.25 billion of long-term debt in September and November of 2023, partially offset by a reduction in interest income due to lower average cash and short-term investment balances versus the prior year. Interest expense, net decreased $123 million in 2023 due t"""
MANAGEMENT,NarrativeText,"""the favorable impact of higher interest rates on interest income, partially offset by the negative impact of interest rate hedge contracts related to certain fixed-rate debt."""
MANAGEMENT,NarrativeText,"""Other income, net was $376 million of income in 2024,  $479 million"""
MANAGEMENT,NarrativeText,"""of income in 2023 and $321 million of income in 2022. Other income, net includes income of approximat"""
MANAGEMENT,NarrativeText,"""ely $542 million, $498 million, and $406 million in 2024, 2023, and 2022, respectively, related to the non-service cost components of the net periodic benefit costs associated with the pension and post-retirement medical plans."""
MANAGEMENT,NarrativeText,"""The decrease in 2024 reflects the recognition of a $143 million loss on the sale of a non-core business related to the Established Pharmaceutical Products segment. The decrease in 2024 was partially offset by an increase in income associated with the non-service cost components of net pension and post-retirement medical benefit costs. In 2023,"""
MANAGEMENT,NarrativeText,"""Other income, net included"""
MANAGEMENT,NarrativeText,"""equity investment impairments that totaled approximately $39 million, as well as income from a $42 million reduction in the fair value of contingent consideration related to previous business acquisitions."""
MANAGEMENT,NarrativeText,"""Taxes on earnings reflect the annual effective rates, including charges for interest and penalties. Deferred income taxes reflect the tax consequences on future years of differences between the tax bases of assets and liabilities and their financial reporting amounts."""
MANAGEMENT,NarrativeText,"""Taxes on earnings include approximately $50 million, $22 million and $43 million in excess tax benefits associated with share-based compensation in 2024, 2023 and 2022, respectively. As a result of the resolution of various tax positions related to prior years, taxes on earnings in 2024, 2023 and 2022 also include approximately $25 million, $80 million and $20 million of net tax expense, respectively. In the fourth quarter of 2024, taxes on earnings includes $7.5 billion in non-cash valuation allowance adjustments resulting from the restructuring of certain foreign affiliates and the confirmation of certain tax filing positions. The restructuring improved profitability to several of Abbott’s affiliates and management concluded that the related preexisting deferred tax assets, which historically had a full valuation allowance, were more likely than not to be realizable in future periods. In particular, Abbott considered the likelihood of sustained ongoing profitability of the affiliates as a positive factor that outweighed all available negative evidence considered. Accordingly, Abbott released the full valuation allowance on such deferred tax assets and recorded the offset to tax expense."""
MANAGEMENT,NarrativeText,"""The U.S. Tax Cuts and Jobs Act (TCJA) includes a one-time transition tax that is based on Abbott’s total post-1986 earnings and profits (E&P) that were previously deferred from U.S. income taxes. The tax computation also requires the determination of the amount of post-1986 E&P considered held in cash and other specified assets. As of December 31, 2024, the remaining balance of Abbott’s transition tax obligation related to the TCJA is approximately $432 million, which will be paid over the next two years as allowed by the TCJA. Undistributed foreign earnings remain indefinitely reinvested in foreign operations. Determining the amount of unrecognized deferred tax liability related to any remaining undistributed foreign earnings not subject to the transition tax and additional outside basis difference in its foreign entities is not practicable."""
MANAGEMENT,NarrativeText,"""In the U.S., Abbott’s federal income tax returns through 2016 are settled. In September 2023, Abbott received a Statutory Notice of Deficiency (SNOD) from the U.S. Internal Revenue Service (IRS) for the 2019 Federal tax year in the amount of $417 million. The primary adjustments proposed in the SNOD relate to the reallocation of income between Abbott’s U.S. entities and its foreign affiliates. Abbott believes that the income reallocation adjustments proposed in the SNOD are without merit, in part because certain adjustments contradict methods that were agreed to with the IRS in prior audit periods. The SNOD also contains other proposed adjustments that Abbott believes are erroneous and unsupported. Abbott filed a petition with the U.S. Tax Court contesting the SNOD in December 2023."""
MANAGEMENT,NarrativeText,"""In June 2024, Abbott received a SNOD from the IRS for the 2017 and 2018 Federal tax years in the amount of $192 million. The matters proposed in the 2017/2018 SNOD are substantially similar to the income allocation adjustments included in the 2019 SNOD. Abbott filed a petition in September 2024 with the U.S. Tax Court contesting the 2017/2018 SNOD in a manner consistent with its petition for the 2019 SNOD."""
MANAGEMENT,NarrativeText,"""In October 2024, Abbott received a SNOD from the IRS for the 2020 Federal tax year assessing an additional $443 million of income tax. The primary adjustments proposed in the SNOD are substantially similar to the income allocation adjustments included in the 2017/2018 and 2019 SNODs. Abbott believes that the income reallocation adjustments proposed in the SNOD are without merit. The SNOD also contains other proposed adjustments and omissions that Abbott believes are erroneous and unsupported. In addition to the tax assessment for the 2020 tax year, the 2020 SNOD also contested a deduction for which an estimated $440 million cash tax benefit would be available in a different taxable year as allowed under applicable U.S. tax law. Abbott filed a petition with the U.S. Tax Court contesting the SNOD in December 2024."""
MANAGEMENT,NarrativeText,"""Abbott intends to vigorously defend its filing positions through ongoing discussions with the IRS, the IRS independent appeals process and/or through litigation as necessary. Abbott reserves for uncertain tax positions related to unresolved matters with the IRS and other taxing authorities. Abbott continues to believe that its reserves for uncertain tax positions are appropriate."""
MANAGEMENT,NarrativeText,"""There are numerous other income tax jurisdictions for which tax returns are not yet settled, none of which Abbott expects to be individually significant. Reserves for interest and penalties are not significant."""
MANAGEMENT,NarrativeText,The Organization for Economic Cooperation & Development (OECD) has proposed a two-pillared plan for a revised international tax system. Pillar 1 proposes to reallocate taxing rights among the jurisdictions in which in-scope multinational corporations operate. Abbott is continuing to analyze the Pillar 1 proposal. Pillar 2 proposes to assess a 15 percent minimum tax on the earnings of in-scope multinational corporations on a country-by-country basis. Numerous countries have enacted legislation to adopt the Pillar 2 model rules. The enactment of current Pillar 2 model rules did not and is not projected to have a material impact to Abbott's consolidated financial statements.
MANAGEMENT,NarrativeText,"""Abbott currently has numerous pharmaceutical, medical device, diagnostic and nutritional products in development."""
MANAGEMENT,NarrativeText,"""In the Established Pharmaceutical Products segment, the development process focuses on the geographic expansion and continuous improvement of the segment’s existing products to provide benefits to patients and customers. As Established Pharmaceutical Products does not actively pursue primary research, development usually begins with work on existing products or after the completion of an acquisition or licensing agreement."""
MANAGEMENT,NarrativeText,"""Depending upon the product, the phases of development may include:"""
MANAGEMENT,ListItem,Drug product development.
MANAGEMENT,ListItem,Phase I bioequivalence studies to compare a future Established Pharmaceutical’s brand with an already marketed compound with the same active pharmaceutical ingredient (API).
MANAGEMENT,ListItem,Phase II studies to test the efficacy of benefits in a small group of patients.
MANAGEMENT,ListItem,Phase III studies to broaden the testing to a wider population that reflects the actual medical use.
MANAGEMENT,ListItem,Phase IV and other post-marketing studies to obtain new clinical use data on existing products within approved indications.
MANAGEMENT,NarrativeText,"""The specific requirements (e.g., scope of clinical trials) for obtaining regulatory approval vary across different countries and geographic regions. The process may range from one year for a bioequivalence study project to six or more years for complex formulations, new indications, or geographic expansion in specific countries."""
MANAGEMENT,NarrativeText,"""In the Diagnostic Products segment, the phases of the research and development process include:"""
MANAGEMENT,ListItem,"""Discovery, which focuses on identification of a product that will address a specific therapeutic area, platform, or unmet clinical need."""
MANAGEMENT,ListItem,"""Concept/Feasibility, during which the materials and manufacturing processes are evaluated; testing may include product characterization and analysis is performed to confirm clinical utility."""
MANAGEMENT,ListItem,"""Development, during which extensive testing is performed to demonstrate that the product meets specified design requirements and that the design specifications conform to user needs and intended uses."""
MANAGEMENT,NarrativeText,"""The regulatory requirements for diagnostic products vary across different countries and geographic regions. In the U.S., the FDA classifies diagnostic products into classes (I, II, or III) and the classification determines the regulatory process for approval. While the Diagnostics segment has products in all three classes, the vast majority of its products are categorized as Class I or Class II. Submission of a separate regulatory filing is not required for Class I products. Class II products typically require premarket notification to the FDA through a regulatory filing known as a 510(k) submission. Most Class III products are subject to the FDA’s Premarket Approval (PMA) requirements. Other Class III products, such as those used to screen blood, require the submission and approval of a Biological License Application (BLA)."""
MANAGEMENT,NarrativeText,"""In the European Union (EU), diagnostic products are also categorized into different categories and the regulatory process, which had been governed by the European In Vitro Diagnostic Medical Device Directive, depends upon the category. Certain product categories requiring review and approval by an independent company, known as a Notified Body, before the manufacturer can affix a CE mark to the product to declare conformity to the Directive. Other products only require a self-certification process. In 2017, the EU adopted the new In Vitro Diagnostic Regulation (IVDR) which replaced the existing directive in the EU for in vitro diagnostic products and imposed additional premarket and post-market regulatory requirements on manufacturers of such products. In July 2024, the IVDR was amended to extend the transition timeline period for dates of compliance as long as December 2029, depending on the diagnostic device classification."""
MANAGEMENT,NarrativeText,"""The diagnostic device must meet additional specific conditions set out in the amended regulations. However, the amendment did not delay the date of application of the IVDR itself which took effect on May 26, 2022."""
MANAGEMENT,NarrativeText,"""In the Medical Devices segment, the research and development process begins with research on a specific technology that is evaluated for feasibility and commercial viability. If the research program passes that hurdle, it moves forward into development. The development process includes evaluation, selection and qualification of a product design, completion of applicable clinical trials to test the product’s safety and efficacy, and validation of the manufacturing process to demonstrate its repeatability and ability to consistently meet pre-determined specifications."""
MANAGEMENT,NarrativeText,"""Similar to the diagnostic products discussed above, in the U.S., medical devices are classified as Class I, II, or III. Most of Abbott’s medical device products are classified as Class II devices that follow the 510(k) regulatory process or Class III devices that are subject to the PMA process."""
MANAGEMENT,NarrativeText,"""In the EU, medical devices are also categorized into different classes and the regulatory process, which had been governed by the European Medical Device Directive and the Active Implantable Medical Device Directive, varies by class. In the second quarter of 2017, the EU adopted the new Medical Devices Regulation (MDR) which replaced the existing directives in the EU for medical devices and imposes additional premarket and post-market regulatory requirements on manufacturers of such products. The MDR applies to manufacturers as of May 26, 2021 with extended transition periods lasting as long as December 31, 2028 depending on the risk classification of the device in the regulation. Each product must bear a CE mark to show compliance with the MDR."""
MANAGEMENT,NarrativeText,"""Some products require submission of a design dossier to the appropriate regulatory authority for review and approval prior to CE marking of the device. For other products, the company is required to prepare a technical file which includes testing results and clinical evaluations but can self-certify its ability to apply the CE mark to the product. Outside the U.S. and the EU, the regulatory requirements vary across different countries and regions."""
MANAGEMENT,NarrativeText,"""After approval and commercial launch of some medical devices, post-market trials may be conducted either due to a conditional requirement of the regulatory market approval or with the objective of proving product superiority."""
MANAGEMENT,NarrativeText,"""In the Nutritional Products segment, the research and development process generally focuses on identifying and developing ingredients and products that address the nutritional needs of particular populations (e.g., infants and adults) or patients (e.g., people with diabetes). Depending upon the country and/or region, if claims regarding a product’s efficacy will be made, clinical studies typically must be conducted."""
MANAGEMENT,NarrativeText,"""In the U.S., the FDA requires that it be notified of proposed new formulations and formulation or packaging changes related to infant formula products. Prior to the launch of an infant formula or product packaging change, the company is required to obtain the FDA’s confirmation that it has no objections to the proposed product or packaging. For other nutritional products, notification or pre-approval from the FDA is not required unless the product includes a new food additive. In some countries, regulatory approval may be required for certain nutritional products, including infant formula and medical nutritional products."""
MANAGEMENT,NarrativeText,"""In 2025 and beyond, Abbott expects to focus on the following areas:"""
MANAGEMENT,NarrativeText,"""Established Pharmaceuticals — Abbott focuses on building country-specific portfolios made up of high-quality medicines that meet the needs of people in emerging markets. Over the next several years, Abbott plans to expand its"""
MANAGEMENT,NarrativeText,"""product portfolio in key therapeutic areas and biosimilars with the aim of addressing the health needs of more people in emerging markets and being among the first to launch new off-patent and differentiated medicines. In addition, Abbott continues to expand existing brands into new markets, implement product enhancements that provide value to patients and acquire strategic products and technology through licensing activities. Abbott is also actively working on the further development of several key brands such as Creon™, Duphaston™, Femoston™ and Influvac™. Depending on the product, the activities focus on development of new data, markets, formulations, delivery systems, or indications."""
MANAGEMENT,NarrativeText,Medical Devices — Abbott’s research and development programs focus on:
MANAGEMENT,ListItem,"""Cardiac Rhythm Management – Development of next-generation rhythm management technologies, including advanced communication capabilities and leadless pacing therapies."""
MANAGEMENT,ListItem,"""Heart Failure – Continued enhancements to Abbott’s mechanical circulatory support and pulmonary artery pressure systems, including enhanced clinical performance and usability."""
MANAGEMENT,ListItem,"""Electrophysiology – Development of next-generation technologies in the areas of ablation, diagnostic, mapping, and visualization and recording."""
MANAGEMENT,ListItem,Vascular – Development of next-generation technologies for use in coronary and peripheral vascular procedures.
MANAGEMENT,ListItem,"""Structural Heart – Development of transcatheter and surgical devices for the repair and replacement of heart valves, and occlusion therapies for congenital heart defects and stroke-risk reduction."""
MANAGEMENT,ListItem,"""Neuromodulation – Development of clinical evidence and next-generation technologies leveraging digital health to support improved patient clinical outcomes, physician engagement, and expanded indications in the treatment of chronic pain, movement disorders and other indications."""
MANAGEMENT,ListItem,Diabetes Care – Develop enhancements and additional indications for continuous monitoring products to help patients improve their ability to manage diabetes and for use beyond diabetes.
MANAGEMENT,NarrativeText,"""Nutritionals — Abbott is focusing its research and development spend on platforms that span the pediatric and adult nutrition areas: gastrointestinal/immunity health, brain health, mobility and metabolism, and user experience platforms. Numerous new products that build on advances in these platforms are currently under development, including clinical outcome testing, and are expected to be launched over the coming years."""
MANAGEMENT,NarrativeText,"""Core Laboratory Diagnostics — Abbott continues to commercialize its next-generation blood and plasma screening, immunoassay, clinical chemistry and hematology systems, along with assays, including a focus on unmet medical needs, in various areas including infectious disease, cardiac care, metabolics, oncology, and neurologic assays as well as informatics solutions to help optimize diagnostics laboratory performance and automation solutions to increase efficiency in laboratories."""
MANAGEMENT,NarrativeText,"""Rapid Diagnostics — Abbott’s research and development programs focus on the development of diagnostic products for infectious disease, cardiometabolic disease and toxicology."""
MANAGEMENT,NarrativeText,"""In addition, the Diagnostic Products segment continues to pursue the FDA’s customary regulatory process for remaining COVID-19 tests for which Emergency Use Authorizations (EUAs) were obtained and yet to be cleared."""
MANAGEMENT,NarrativeText,"""Given the diversity of Abbott’s business, its intention to remain a broad-based health care company and the numerous sources for potential future growth, no individual project is expected to be material to cash flows or results of operations over the next five years. Factors considered included research and development expenses projected to be incurred for the project over the next year relative to Abbott’s total research and development expenses, as well as qualitative factors, such as marketplace perceptions and impact of a new product on Abbott’s overall market position. There were no delays in Abbott’s 2024 research and development activities that are expected to have a material impact on operations."""
