section,element_type,text
RISK_FACTORS,NarrativeText,"""In addition to the other information in this report, the following risk factors should be considered before deciding to invest in any of Abbott’s securities. Additional risks and uncertainties not presently known to Abbott, or risks Abbott currently considers immaterial, could also affect Abbott’s actual results. Abbott’s business, financial condition, results of operations, or prospects could be materially adversely affected by any of these risks."""
RISK_FACTORS,NarrativeText,"""Disruptions to Abbott’s global supply chain, which is large and complex, could negatively affect Abbott’s results of operations"""
RISK_FACTORS,NarrativeText,"""Abbott’s operations and performance depend on its ability to manage its large and complex global supply chain. While Abbott has taken and will continue to take actions to mitigate the risks of disruptions to its global supply chain, disruptions to it could negatively affect Abbott's results of operations. For example, the COVID-19 pandemic and macroeconomic conditions such as inflationary pressures and labor shortages contributed to global supply chain challenges in the early part of the decade, which adversely impacted the cost and availability of certain raw materials, supplies, and services."""
RISK_FACTORS,NarrativeText,"""Abbott may acquire other businesses, license rights to technologies or products, form alliances, or dispose of or spin-off businesses, which could cause it to incur significant expenses and could negatively affect profitability."""
RISK_FACTORS,NarrativeText,"""From time to time, Abbott pursues acquisitions, licensing arrangements, and strategic alliances, or may dispose of or spin-off some of its businesses, as part of its business strategy. Abbott may not complete these transactions in a timely manner, on a cost-effective basis, or at all, and may not realize the expected benefits. If Abbott is successful in making an acquisition, the products and technologies that are acquired may not be successful or may require significantly greater resources and investments than originally anticipated. Abbott may not be able to integrate acquisitions successfully into its existing business or transition disposed businesses efficiently, and could incur or assume significant debt and unknown or contingent liabilities. Abbott could also experience negative effects on its reported results of operations from acquisition or disposition-related charges, amortization of expenses related to intangibles and charges for impairment of long-lived assets. These effects could cause a deterioration of Abbott’s credit rating, result in increased borrowing costs and interest expense, and decrease liquidity."""
RISK_FACTORS,NarrativeText,"""Abbott depends on sophisticated information systems and maintains protected personal data, and a significant cybersecurity incident or other disruption affecting these information systems or protected data could have a material adverse effect on Abbott’s business, financial condition and results of operations."""
RISK_FACTORS,NarrativeText,"""Similar to other large multi-national companies, the size and complexity of the information systems on which Abbott relies for both its infrastructure and products make them susceptible to a cybersecurity incident, breakdown, destruction, loss of data privacy, or other significant disruption. These systems have been and are expected to continue to be the target of malware and other cybersecurity incidents. In addition, third party hacking attempts may cause Abbott’s information systems and related products, protected data, or proprietary information to be compromised or stolen. A significant cybersecurity incident or other disruption could result in adverse consequences, including regulatory inquiries or litigation, increased costs and expenses, manufacturing challenges or disruption, problems with product availability, functionality or safety, damage to customer relations, reputational damage, lost revenue, and fines or penalties."""
RISK_FACTORS,NarrativeText,"""Abbott also collects, manages and processes protected personal data, including protected health information, in connection with certain medical products and service offerings. Abbott is subject to numerous data privacy and data protection laws and regulations globally, including data protection laws that prohibit or restrict the transfer of protected data across country borders. For additional information concerning data privacy and security regulation, see the discussion in “Regulation” under Item 1, “Business.” A breach or unauthorized disclosure of protected personal information could result in adverse consequences, including regulatory inquiries or litigation, increased costs and expenses, reputational damage, lost revenue, and fines or penalties."""
RISK_FACTORS,NarrativeText,"""Abbott invests in its information systems and technology and in the protection of its products and data to reduce the risk of a cybersecurity incident or other significant disruption, and monitors its information systems on an ongoing basis for any current or potential cybersecurity threats or vulnerabilities and for changes in technology and the regulatory environment. There can be no assurance that these measures and efforts will prevent future cybersecurity incidents or other significant disruptions to any of the information systems on which Abbott relies or that related product issues will not arise in the future. Similarly, there can be no assurance that third party information technology providers or other partners with whom Abbott contracts will not suffer a significant cybersecurity incident or disruption that impacts Abbott. Any significant cybersecurity incident or other disruption affecting Abbott’s information systems or products could have a material adverse effect on Abbott’s business, financial condition and results of operations."""
RISK_FACTORS,NarrativeText,"""Abbott’s research and development efforts to develop commercially successful products and technologies and its efforts to develop and maintain new business and operating models necessary to support data-driven healthcare solutions may not succeed, either of which may cause Abbott’s revenue and profitability to decline."""
RISK_FACTORS,NarrativeText,"""To remain competitive, Abbott must continue to launch new products and technologies. To accomplish this, Abbott commits substantial efforts, funds, and other resources to research and development. A risk of failure is inherent in the research and development of new products and technologies. Abbott must make ongoing substantial expenditures without any assurance that its efforts will be commercially successful. Failure can occur at any point in the process, including after significant funds have been invested."""
RISK_FACTORS,NarrativeText,"""Promising new products and technologies may fail to reach the market or may only have limited commercial success because of efficacy or safety concerns, failure to achieve positive clinical outcomes, inability to obtain necessary regulatory approvals, limited scope of approved uses, excessive costs to manufacture, failure to establish or maintain intellectual property rights, or infringement of the intellectual property rights of others. Even if Abbott successfully develops new products or enhancements or new generations of Abbott’s existing products, they may be quickly rendered obsolete by changing customer preferences, changing industry or regulatory standards, or competitors’ innovations. Innovations may not be accepted quickly in the marketplace because of, among other things, entrenched patterns of clinical practice or uncertainty over third-party reimbursement. Abbott cannot state with certainty when or whether any of its products under development will be launched, whether it will be able to develop, license, or otherwise acquire compounds or products, or whether any products will be commercially successful. Failure to launch successful new products or technologies, or new indications or uses for existing products, may cause Abbott’s products or technologies to become obsolete, causing Abbott’s revenues and operating results to suffer."""
RISK_FACTORS,NarrativeText,"""In addition, Abbott is developing new business and operating models necessary to support the creation of data-driven healthcare solutions such as data-centric prevention and treatment strategies, new products and technologies that incorporate data insights, and product technology strategies that focus on connectivity and data creation management. Even if Abbott successfully develops such new data-driven healthcare solutions, they may be rendered obsolete by competitors' innovations, the nature of the data and insights generated, or changing customer preferences. Failure to develop and maintain business and operating models necessary to support data-driven healthcare solutions may negatively impact the demand for Abbott products and technologies, causing Abbott's revenues and profitability to decline."""
RISK_FACTORS,NarrativeText,"""The manufacture of many of Abbott's products is a highly exacting and complex process, and if Abbott or one of its suppliers or manufacturers encounters problems manufacturing products, Abbott’s business could suffer."""
RISK_FACTORS,NarrativeText,"""The manufacture of many of Abbott’s products is a highly exacting and complex process, due in part to strict regulatory requirements. Problems may arise during manufacturing for a variety of reasons, including equipment malfunction, failure to follow specific protocols and procedures, problems with raw materials or the global supply chain, failure to meet product specifications, cybersecurity incidents, natural disasters, and environmental factors. In addition, single suppliers are currently used for certain products and materials. If problems arise during the production of a lot or batch of product, those products may have to be discarded. If problems are not discovered before the product is released to the market, recall and product liability costs may also be incurred. Any of these events could, among other things, lead to increased costs, lost revenue, damage to customer relations, reputational damage, time and expense spent investigating the cause and remediating the problem, if any, a production stoppage at a manufacturing facility, and depending on the cause, similar losses with respect to other lots, batches or products. To the extent Abbott or one of its suppliers or manufacturers experiences significant manufacturing problems, this could have a material adverse effect on Abbott’s revenues and profitability."""
RISK_FACTORS,NarrativeText,"""Abbott has indebtedness, which could adversely affect its business, including decreasing its business flexibility."""
RISK_FACTORS,NarrativeText,"""As of December 31, 2024, Abbott's consolidated indebtedness was approximately $14.1 billion. This consolidated indebtedness could have the effect, among other things, of reducing Abbott's flexibility to respond to changing business"""
RISK_FACTORS,NarrativeText,"""and economic conditions, and reducing funds available for working capital, capital expenditures, acquisitions, and other general corporate purposes."""
RISK_FACTORS,NarrativeText,"""Further, Abbott may be required to raise additional financing for working capital, capital expenditures, future acquisitions or other general corporate purposes. Abbott's ability to arrange additional financing or refinancing will depend on, among other factors, Abbott's financial position and performance, as well as prevailing market conditions and other factors beyond Abbott's control. Consequently, Abbott cannot assure that it will be able to obtain additional financing or refinancing on terms acceptable to Abbott or at all, which could adversely impact Abbott's ability to make scheduled payments with respect to its consolidated indebtedness and its profitability and financial condition."""
RISK_FACTORS,NarrativeText,"""Additionally, further borrowing could cause a deterioration of Abbott's credit ratings. Abbott's credit ratings reflect each credit rating agency's then opinion of Abbott's financial strength, operating performance, and ability to meet its debt obligations. Adverse changes in Abbott's credit ratings may result in increased borrowing costs for future long-term debt or short-term borrowing facilities and may limit financing options, including access to the unsecured borrowing market. Abbott may also be subject to additional restrictive covenants that would reduce flexibility."""
RISK_FACTORS,NarrativeText,"""It is costly for Abbott to comply with numerous governmental regulations and to develop compliant products and processes, and consequences for non-compliance could have a material adverse effect on Abbott's revenues, profitability, cash flows, and financial condition."""
RISK_FACTORS,NarrativeText,"""Abbott’s products are subject to rigorous regulation by the FDA and numerous international, supranational, federal, and state authorities. The process of obtaining regulatory approvals to market a drug, medical device, diagnostic product, or nutritional product can be costly and time-consuming, and approvals might not be granted for future products, or additional indications or uses of existing products, on a timely basis, if at all. Delays in the receipt of, or failure to obtain, approvals for future products, or new indications and uses, could result in delayed realization of product revenues, reduction in revenues, and substantial additional costs."""
RISK_FACTORS,NarrativeText,"""In addition, no assurance can be given that Abbott will remain in compliance with applicable FDA and other regulatory requirements once approval, clearance, or marketing authorization has been obtained for a product. These requirements include, among other things, regulations regarding manufacturing practices, product labeling, postmarket changes to products, advertising, and postmarketing reporting, including adverse event reports and field alerts. Many of Abbott’s facilities and procedures and those of Abbott’s suppliers are subject to ongoing regulation, including periodic inspection by the FDA and other regulatory authorities. Abbott must incur expense and spend time and effort to ensure compliance with these complex regulations. Possible regulatory actions for non-compliance include warning letters, fines, damages, injunctions, civil penalties, recalls, consent decrees, seizures of Abbott’s products, and civil litigation and/or criminal prosecution."""
RISK_FACTORS,NarrativeText,"""These actions could result in, among other things, substantial modifications to Abbott’s business practices and operations; refunds, recalls, or seizures of Abbott’s products; a total or partial shutdown of production in one or more facilities while Abbott or Abbott’s suppliers remedy any actual or potential issues; the inability to obtain future product approvals, clearances, or marketing authorizations; and withdrawals or suspensions of current products from the market. Any of these events could disrupt Abbott’s business and have a material adverse effect on Abbott’s revenues, profitability, cash flows, and financial condition. For example, in February 2022, Abbott initiated a voluntary recall of certain powder infant formula products manufactured at its facility in Sturgis, Michigan at which time it temporarily stopped manufacturing at the facility. In May 2022, Abbott entered into a consent decree with the FDA. For information on the impact of Abbott's voluntary recall and manufacturing stoppage, see the discussion in the “Financial Review” section in Item 7, Management’s Discussion and Analysis of Financial Condition and Results of Operations, of this report."""
RISK_FACTORS,NarrativeText,"""Laws and regulations affecting government benefit programs could impose new obligations on Abbott, require Abbott to change its business practices, and restrict its operations, which could result in a material adverse effect on Abbott's revenues, profitability, and financial condition."""
RISK_FACTORS,NarrativeText,"""Abbott’s industry is subject to various international, supranational, federal, and state laws and regulations pertaining to government benefit program reimbursement, price reporting and regulation, and healthcare fraud and abuse, including anti-kickback and false claims laws, and international and individual state laws relating to pricing and sales and marketing practices. Violations of these laws may be punishable by criminal and/or civil sanctions, including, in some instances, substantial fines, imprisonment, and exclusion from participation in government healthcare programs, including Medicare, Medicaid, and Veterans Administration health programs in the U.S. These laws and regulations are broad in scope and they are subject to evolving interpretations, which could require Abbott to incur substantial costs associated with compliance or to alter one or more of its sales or marketing practices. In addition, violations of these laws, or allegations of such"""
RISK_FACTORS,NarrativeText,"""violations, could disrupt Abbott’s business and result in a material adverse effect on Abbott’s revenues, profitability, and financial condition."""
RISK_FACTORS,NarrativeText,Changes in the healthcare regulatory environment may adversely impact the demand for and price of Abbott’s products.
RISK_FACTORS,NarrativeText,"""Both in the U.S. and internationally, government authorities may enact changes in regulatory requirements, make legislative or administrative reforms to existing reimbursement programs, make adverse decisions relating to Abbott’s products’ coverage or reimbursement, or make changes to patient access to healthcare, all of which could adversely impact the demand for and usage of Abbott’s products or the prices that Abbott’s customers are willing to pay for them."""
RISK_FACTORS,NarrativeText,"""Further, in the U.S., a number of the provisions of the Affordable Care Act and the Health Care and Education Reconciliation Act of 2010 address access to healthcare products and services. These provisions may be modified, expanded, repealed, or otherwise invalidated, in whole or in part. Future rulemaking could affect rebates, prices or the rate of price increases for healthcare products and services, or required reporting and disclosure. Abbott cannot predict the timing or impact of any future rulemaking or changes in the law."""
RISK_FACTORS,NarrativeText,"""For additional information concerning healthcare regulation, see the discussion in “Regulation” under Item 1, “Business.”"""
RISK_FACTORS,NarrativeText,The expiration or loss of intellectual property protection and licenses may affect Abbott’s future revenues and operating income.
RISK_FACTORS,NarrativeText,"""Many of Abbott’s businesses rely on patent and trademark and other intellectual property protection. Although most of the challenges to Abbott’s intellectual property have come from other companies, governments may also challenge intellectual property protections. To the extent Abbott’s intellectual property is successfully challenged, invalidated, or circumvented or to the extent it does not allow Abbott to compete effectively, Abbott’s businesses could suffer. To the extent that countries do not enforce Abbott’s intellectual property rights, Abbott’s future revenues and operating income could be reduced. Any material litigation regarding Abbott’s patents and trademarks is described in the section captioned “Legal Proceedings.”"""
RISK_FACTORS,NarrativeText,"""Significant safety concerns could arise for Abbott’s products, which could have a material adverse effect on Abbott’s revenues and financial condition."""
RISK_FACTORS,NarrativeText,"""Healthcare products typically receive regulatory approval based on data obtained in controlled clinical trials of limited duration. Following regulatory approval, these products will be used over longer periods of time in many patients. Investigators may also conduct additional, and perhaps more extensive, studies. When new safety concerns are reported, Abbott may be required to amend the conditions of use for a product. For example, Abbott may be required to provide additional warnings on a product’s label or narrow its approved intended use, either of which could reduce the product’s market acceptance. If serious safety concerns arise with an Abbott product, sales of the product have been and could be halted by Abbott or by regulatory authorities. Safety concerns affecting suppliers’ or competitors’ products also may reduce the market acceptance of Abbott’s products."""
RISK_FACTORS,NarrativeText,"""In addition, in the ordinary course of business, Abbott is the subject of product liability claims and lawsuits alleging that its products or the products of other companies that Abbott promotes have resulted or could result in an unsafe condition for, or injury to, patients. Product liability claims and lawsuits, safety alerts or product recalls, and other allegations of product safety or quality issues, regardless of their validity or ultimate outcome, may have a material adverse effect on Abbott’s business and reputation and on Abbott’s ability to attract and retain customers. Consequences may also include additional costs, a decrease in market share for the products, lower income or exposure to other claims. Product liability losses are self-insured and could have a material adverse effect on Abbott’s profitability, cash flows, and financial condition."""
RISK_FACTORS,NarrativeText,Abbott is subject to cost containment efforts that could cause a reduction in future revenues and operating income.
RISK_FACTORS,NarrativeText,"""In the United States and other countries, Abbott’s businesses have experienced downward pressure on certain product pricing. Cost containment efforts by governments and private organizations are described in greater detail in the section captioned “Regulation.” To the extent these cost containment efforts are not offset by greater patient access to healthcare or other factors, Abbott’s future revenues and operating income will be reduced."""
RISK_FACTORS,NarrativeText,Competitors’ intellectual property may prevent Abbott from selling its products or have a material adverse effect on Abbott’s future profitability and financial condition.
RISK_FACTORS,NarrativeText,"""In the ordinary course of business, Abbott is the subject of patent litigation, such as competitor claims that an Abbott product infringes their intellectual property. Resolving an intellectual property infringement claim can be costly and time"""
RISK_FACTORS,NarrativeText,"""consuming and may require Abbott to enter into license agreements. Abbott cannot guarantee that it would be able to obtain license agreements on commercially reasonable terms. A successful claim of patent or other intellectual property infringement could subject Abbott to significant damages or an injunction preventing the manufacture, sale or use of affected Abbott products. Any of these events could have a material adverse effect on Abbott’s profitability and financial condition."""
RISK_FACTORS,NarrativeText,New products and technological advances by Abbott’s competitors may negatively affect Abbott’s results of operations.
RISK_FACTORS,NarrativeText,"""Abbott’s products face intense competition from competitors' products and technological advances. Competitors’ products may be safer, more effective, more effectively marketed or sold, or have lower prices or superior performance features than Abbott’s products. Further, the development of new technology, healthcare products and medicines, and the development of new treatments for disease could significantly change the competitive landscape of the healthcare industry and negatively impact the demand for certain Abbott products. Abbott cannot predict with certainty the timing or impact of the introduction of competitors’ products and technological advances."""
RISK_FACTORS,NarrativeText,Fluctuation in foreign currency exchange rates has adversely affected and may continue to adversely affect Abbott’s financial statements and its ability to realize projected sales and earnings.
RISK_FACTORS,NarrativeText,"""Although Abbott’s financial statements are denominated in U.S. dollars, a significant portion of Abbott’s revenues and costs are realized in other currencies. Sales outside of the U.S. in 2024 made up approximately 61 percent of Abbott’s net sales. Abbott’s profitability is affected by movement of the U.S. dollar against other currencies. Fluctuations in exchange rates between the U.S. dollar and other currencies may also affect the reported value of Abbott’s assets and liabilities, as well as its cash flows. Some foreign currencies are subject to government exchange controls. While Abbott enters into hedging arrangements to mitigate some of its foreign currency exposure, Abbott cannot predict with any certainty changes in foreign currency exchange rates or its ability to mitigate these risks."""
RISK_FACTORS,NarrativeText,"""Information on the impact of foreign exchange rates on Abbott’s financial results is contained in the “Financial Review — Results of Operations” section in Item 7, Management’s Discussion and Analysis of Financial Condition and Results of Operations, of this report. A discussion of the steps taken to mitigate the impact of foreign exchange is contained in Item 7A, Quantitative and Qualitative Disclosures about Market Risk, of this report. Information on Abbott’s hedging arrangements is contained in Note 12 to the consolidated financial statements in this report."""
